""!#"V03033.01289L"!#"vente"!#"maison/villa"!#"84400"!#"SAIGNON"!#"France"!#""!#""!#""!#"920000.00"!#""!#""!#""!#"0.0"!#"203.00"!#"190.00"!#""!#"3"!#"Maison de village spacieuse avec jardin, piscine et  une vue panoramique."!#"Au cœur du charmant et authentique village de Saignon, cette belle maison de village est située dans un cadre calme. Les boutiques, bars et restaurants sont accessibles à pied et le centre animé d'Apt, avec son célèbre marché, se trouve à seulement 5 minutes.  La maison a été récemment profondément rénovée en conservant des éléments authentiques comme les tomettes, la cheminée, les plafonds provençaux et les poutres en bois pour créer une atmosphère chaleureuse.  Depuis le toit-terrasse, vous avez une vue panoramique sur le Luberon avec le coucher de soleil magique le soir. Le jardin est un rare atout, ensoleillé et abrité orienté sud-ouest avec une piscine de 4m x 7m sans vis-à-vis. Et pour les chaudes soirées d'été ou les jours de pluie, la terrasse voûtée offre fraîcheur et abri.  Avec plus de 70 m2 de caves, dont une cave à vin accessible depuis la maison, il y a beaucoup d'espace de stockage. Plusieurs caves se trouvent au niveau de la rue, ce qui permet de ranger facilement les vélos. La propriété est accessible en voiture toute l'année pour le (dé)chargement à la porte. Il y a un grand parking à moins de 300 mètres.  Le rez-de-chaussée se compose d'une chambre ensoleillée avec salle d'eau, d'une entrée séparée qui donne accès à un appartement avec un coin salon confortable, d'une cuisine équipée, d'une toilette d'invité et d'une chambre spacieuse avec salle d'eau et un balcon privé. Le rez-de-chaussée donne accès à la terrasse voûtée et au jardin et comprend également un local technique et l'accès à la cave à vin.  Le premier étage abrite une grande espace de vie avec le salon, la salle à manger avec cheminée et une cuisine ouverte. Depuis la table à manger, grâce aux grandes fenêtres, vous avez une vue imprenable sur le Luberon. Le salon, à la fois vaste et intime, s'ouvre sur la grande terrasse, elle aussi dotée de grandes baies vitrées pour profiter au maximum de la lumière et de la vue. Cette terrasse, en partie couverte, est orientée sud-ouest pour profiter du soleil toute la journée et toute l'année. Avec un barbecue extérieur et de magnifiques couchers de soleil, c'est l'endroit idéal pour profiter des soirées provençales avec les amis et la famille.  Au deuxième étage se trouve la chambre principale avec sa salle d'eau où vous pourrez vous retirer en toute intimité et encore une fois jouir d'une vue panoramique. Les équipements techniques installés récemment comprennent : chaudière à condensation au fioul pour toute la maison ; climatisation avec pompe à chaleur dans le salon et l'appartement au rez-de-chaussée ; double vitrage avec menuiseries en bois ajoutant un élément d'esthétique traditionnelle ; fibre optique ; grands espaces de stockage répartis sur 4 caves.  L'appartement au rez-de-chaussée avec entrée privée est idéal pour la location saisonnière.Cette fantastique propriété est idéale pour ceux qui recherchent la paix et la tranquillité pour jouir de vues panoramiques de chez eux, mais aussi l'animation d'une des plus beaux villages de Luberon.Les informations sur les risques auxquels ce bien est exposé sont disponibles sur le site Géorisques : http://www.georisques.gouv.fr"!#""!#""!#""!#""!#""!#"1850"!#""!#"3"!#""!#"5"!#""!#"1024"!#"1"!#""!#""!#""!#""!#""!#""!#""!#""!#""!#""!#""!#""!#""!#""!#""!#""!#""!#""!#""!#""!#""!#""!#""!#""!#""!#""!#""!#""!#""!#"OUI"!#"OUI"!#""!#""!#""!#""!#""!#""!#""!#""!#""!#""!#""!#""!#""!#""!#""!#""!#""!#""!#""!#""!#""!#""!#""!#""!#""!#""!#""!#""!#""!#""!#""!#""!#""!#""!#""!#""!#""!#""!#"https://my.matterport.com/show/?m=2LFLKZ6t26T"!#""!#""!#""!#""!#""!#""!#""!#""!#""!#""!#""!#""!#""!#""!#""!#""!#""!#""!#""!#"EN"!#""!#"Spacious village property with garden and pool in Saignon."!#"Located in the heart of the charming and authentic village of Saignon, this spacious and beautiful village house enjoys a peaceful setting. Shops, bars, and restaurants are within walking distance, and the lively center of Apt, with its famous market, is just 5 minutes away.The property has recently been extensively renovated, retaining authentic features such as the terracotta tiles, fireplace, Provençal ceilings and wooden beams to create a warm atmosphere.The roof terrace offers panoramic views of the Luberon, with magical sunsets in the evening. A private, sunny and sheltered south-west facing garden with a 4m x 7m swimming pool is unique for a village house. A vaulted terrace provides shade and shelter on hot summer days. With over 70 m² of cellar space, including a wine cellar accessible from the house, there is plenty of storage space. Several cellars are located at street level, allowing easy storage of bicycles.The property is accessible by car year-round for dropping off and picking up directly at the door. There is ample parking less than 300 meters away.The ground floor consists of: a sunny bedroom with an adjoining shower room; separate entrance on the ground floor leading to an apartment with a comfortable sitting area, a fully equipped kitchen, a guest toilet and a spacious bedroom with a shower room and a romantic private balcony.The ground floor provides access to the vaulted terrace and garden and also includes a technical room and access to the wine cellar.The first floor houses a large living space with a living room, a dining room with a fireplace, and an open kitchen. The large windows in the dining area offer breathtaking views of the Luberon. The sitting room, both spacious and intimate, opens onto the large terrace, also featuring floor-to-ceiling windows to maximize natural light and take full advantage of the view. This partially covered terrace faces southwest to enjoy the sun all day, all year round. With an outdoor barbecue and magnificent sunsets, it's the perfect place to enjoy Provençal evenings with friends and family.On the second floor is the master bedroom with en-suite shower room, where you can retreat in complete privacy and once again enjoy the panoramic view.Recently installed technical equipment includes: oil-fired condensing heating and hot water boiler; air conditioning with a heat pump in the living room and ground-floor apartment; double glazing with wooden joinery adding a traditional aesthetic; fibre internet; and large storage spaces spread across four cellars.The ground floor appartement with a private entrance is ideal for seasonal rental.This fantastic property is ideal for those seeking the liveliness of one of the most charming villages of the Luberon, but also peace and quiet with panoramic views in their own home."!#""!#""!#""!#""!#""!#""!#""!#""!#""!#""!#""!#""!#""!#""!#""!#""!#""!#""!#""!#""!#""!#""!#""!#""!#""!#""!#""!#""!#""!#""!#""!#""!#""!#""!#""!#""!#""!#""!#""!#""!#""!#""!#""!#""!#""!#""!#""!#"V03033.01289L"!#"288"!#""!#""!#""!#""!#""!#""!#""!#""!#""!#""!#""!#""!#""!#""!#""!#""!#""!#""!#""!#""!#""!#""!#""!#""!#""!#""!#""!#""!#""!#""!#""!#""!#""!#""!#""!#""!#""!#""!#""!#""!#""!#""!#""!#""!#""!#""!#""!#""!#""!#""!#""!#""!#""!#""!#""!#""!#""!#""!#""!#""!#""!#""!#""!#""!#""!#""!#""!#""!#""!#""!#""!#""!#""!#""!#""!#""!#""!#""!#""!#""!#""!#""!#""!#""!#""!#""!#""!#""!#""!#""!#""!#""!#""!#""!#""!#""!#""!#""!#""!#""!#""!#""!#""!#""!#""!#""!#""!#""!#""!#""!#""!#""!#""!#""!#""!#""!#""!#""!#""!#""!#""!#""!#""!#""!#"4.12"!#"1"!#""!#""!#""!#""!#""!#""!#""!#""!#""!#""!#""!#""!#""!#""!#""!#""!#""!#""!#""!#""!#""!#""!#""!#""!#""!#""!#""!#""!#""!#""!#""!#""
""!#"V03032.01413L"!#"vente"!#"maison/villa"!#"84220"!#"GORDES"!#"France"!#""!#""!#""!#"1850000.00"!#""!#""!#""!#"0.0"!#"250.00"!#"1300.00"!#"6"!#"4"!#"Maison de caractère avec jardin, piscine, studio indépendant et vues sur le Luberon."!#"Dans le triangle d'or du Luberon, située dans un quartier prisé et paisible de Gordes, à seulement quelques minutes à pied du c?ur du village, cette belle propriété en pierre allie le charme de l'ancien au confort moderne. Cette demeure rare séduit par son caractère unique, fruit d'une conception harmonieuse où chaque détail reflète l'authenticité et la noblesse des matériaux, conférant à l'ensemble un certain charme. Édifiée sur un terrain de 1 300 m² clos par des murs en pierre sèche, elle offre un cadre de vie authentique et raffiné, typiquement provençal.Le rez-de-chaussée s'organise autour d'un vaste espace de vie baigné de lumière grâce à de grandes ouvertures. Le salon, avec ses tomettes, sa cheminée et ses poutres apparentes, dégage une atmosphère chaleureuse et conviviale. La salle à manger attenante et la cuisine ouverte, à l'esprit provençal, complètent cet espace fluide et accueillant. On y trouve également une suite avec salle d'eau, ainsi qu'un salon d'hiver agrémenté d'une bibliothèque.À l'étage, un palier pouvant faire office de bureau dessert deux suites, chacune disposant de sa salle d'eau privative, offrant confort et intimité.Le jardin paysager exposé plein sud, invite à la détente avec sa terrasse ensoleillée et sa piscine chauffée.Un studio indépendant d'environ 50 m² complète l'ensemble, avec séjour, kitchenette, coin nuit en mezzanine et salle d'eau ? idéal pour recevoir famille ou amis.La propriété dispose également d'un charmant kiosque en fer forgé pouvant servir d'atelier, d'une borie avec son solarium à l'étage, d'un espace de stationnement privé et d'un auvent pour voiture.Une opportunité rare dans l'un des plus beaux villages de France, avec un accès facile à son charmant marché, à des restaurants de renom et à toutes les commodités ? idéal pour une résidence principale ou pour une maison de vacances."!#""!#""!#""!#""!#""!#""!#""!#"4"!#""!#"6"!#""!#""!#"1"!#""!#""!#""!#""!#""!#""!#""!#""!#"3"!#""!#""!#""!#""!#""!#""!#""!#""!#""!#""!#""!#""!#""!#""!#""!#""!#""!#""!#""!#""!#""!#""!#""!#""!#""!#""!#""!#""!#""!#""!#""!#""!#""!#""!#""!#""!#""!#""!#""!#""!#""!#""!#""!#""!#""!#""!#""!#""!#""!#""!#""!#""!#""!#""!#""!#""!#""!#""!#""!#""!#""!#""!#""!#""!#""!#""!#""!#""!#""!#""!#""!#""!#""!#""!#""!#""!#""!#""!#""!#""!#"EN"!#""!#"Character property with garden, pool, independent studio and views of the Luberon."!#"In the Golden Triangle of the Luberon, nestled in a sought-after and peaceful area of Gordes just a few minutes? walk from the heart of the village, this beautiful stone property combines the charm of tradition with modern comfort. This rare home captivates with its unique character, the result of a harmonious design where every detail reflects the authenticity and nobility of the materials, lending the entire property a distinct and timeless charm. Set on a 1,300 m² plot enclosed by dry stone walls, it offers an authentic and refined lifestyle, in true Provençal spirit.The ground floor is centered around a spacious, light-filled living area, thanks to large openings. The sitting room, with terracotta floor tiles, fireplace, and exposed beams, creates a warm and inviting atmosphere. The adjoining dining room and open-plan kitchen, designed in a traditional Provençal style, complete this welcoming and fluid space. An en suite bedroom and a conservatory with a library are also found on this level.Upstairs, a landing?ideal as a study or reading nook?leads to two further en suite bedrooms, each with private shower, offering both comfort and privacy.Facing due south, the landscaped garden is a haven of peace, featuring a sunny terrace and heated swimming pool.An independent studio of around 50 m² completes the property. It includes a living area, kitchenette, mezzanine sleeping space, and shower room?perfect for hosting family or friends.The property also includes a charming wrought-iron gazebo that can serve as an artist?s studio, a traditional 'borie' with rooftop solarium, private parking, and a covered carport.A rare opportunity in one of France's most beautiful villages, with easy access to the charming market, world-class restaurants and all facilities - ideal as a primary residence or a holiday home."!#""!#""!#""!#""!#""!#""!#""!#""!#""!#""!#""!#""!#""!#""!#""!#""!#""!#""!#""!#""!#""!#""!#""!#""!#""!#""!#""!#""!#""!#""!#""!#""!#""!#""!#""!#""!#""!#""!#""!#""!#""!#""!#""!#""!#""!#""!#""!#"V03032.01413L"!#"119"!#""!#""!#""!#""!#""!#""!#""!#""!#""!#""!#""!#""!#""!#""!#""!#""!#""!#""!#""!#""!#""!#""!#""!#""!#""!#""!#""!#""!#""!#""!#""!#""!#""!#""!#""!#""!#""!#""!#""!#""!#""!#""!#""!#""!#""!#""!#""!#""!#""!#""!#""!#""!#""!#""!#""!#""!#""!#""!#""!#""!#""!#""!#""!#""!#""!#""!#""!#""!#""!#""!#""!#""!#""!#""!#""!#""!#""!#""!#""!#""!#""!#""!#""!#""!#""!#""!#""!#""!#""!#""!#""!#""!#""!#""!#""!#""!#""!#""!#""!#""!#""!#""!#""!#""!#""!#""!#""!#""!#""!#""!#""!#""!#""!#""!#""!#""!#""!#""!#""!#""!#""!#""!#""!#""!#"4.12"!#"1"!#""!#""!#""!#""!#""!#""!#""!#""!#""!#""!#""!#""!#""!#""!#""!#""!#""!#""!#""!#""!#""!#""!#""!#""!#""!#""!#""!#""!#""!#""!#""!#""
""!#"V02635.01259L"!#"vente"!#"hôtel particulier"!#"84400"!#"APT"!#"France"!#""!#""!#""!#"2715000.00"!#""!#""!#""!#"0.0"!#"1500.00"!#"12253.00"!#""!#"20"!#"Hôtel-restaurant et Bastide avec piscines en plein coeur du Luberon."!#"Situé a proximité d'une grande ville et de merveilleux sites touristiques, ce bel hôtel-restaurant a beaucoup à offrir et possède un grand potentiel.L'hôtel se compose de 20 chambres climatisées et rénovées avec isolation phonique, réparties en 4 catégories différentes.Le premier niveau s'ouvre sur la réception ainsi que la salle de restauration pouvant accueillir jusqu'à 50 couverts facilement. Un espace buffet agrémente cette pièce. Une grande cuisine professionnelle parfaitement agencée et équipée offre une belle capacité pour réaliser une activité supplémentaire ou augmenter le taux de remplissage.Un espace bar-lounge climatisé ainsi que 5 chambres complètent ce premier niveau.Le deuxième étage accueille 15 autres chambres dont certaines avec terrasses privées et vue sur la piscine.Un sous-sol d'environ 500 m2 avec diverses ouvertures pourrait être transformé en centre bien-être, salle de remise en forme ou salle de réception.Le terrain d'un peu plus d'un hectare offre de multiples espaces extérieurs grâce à ses différentes terrasses, ses deux piscines, son terrain de pétanque, son jardin verdoyant et son grand parking.Une bastide attenante d'environ 600 m2 actuellement utilisé en logement de fonction pourrait être exploité pour 15 chambres supplémentaires ou faire l'objet d'un logement pour le personnel. Ce mas se divise sur 3 niveaux, dispose de sa propre piscine et d'une entrée privative.Cet établissement bien entretenu offre de belles capacités de développement : exploitation hôtelière, gîtes, chambre d'hôtes, évènementiel.Les informations sur les risques auxquels ce bien est exposé sont disponibles sur le site Géorisques : http://www.georisques.gouv.fr"!#""!#""!#""!#""!#""!#"1976"!#""!#"20"!#""!#""!#""!#""!#"9"!#""!#""!#""!#""!#""!#""!#""!#""!#""!#""!#""!#""!#""!#""!#""!#""!#""!#""!#""!#""!#""!#""!#""!#""!#""!#""!#""!#""!#""!#""!#"OUI"!#""!#""!#""!#""!#""!#""!#""!#""!#""!#""!#""!#""!#""!#""!#""!#""!#""!#""!#""!#""!#""!#""!#""!#""!#""!#""!#""!#""!#""!#""!#""!#""!#""!#""!#""!#""!#""!#""!#""!#""!#""!#""!#""!#""!#""!#""!#""!#""!#""!#""!#""!#""!#""!#""!#""!#""!#""!#""!#"EN"!#""!#"Hotel-restaurant and Bastide with swimming pools in the heart of the Luberon."!#"Located near a bustling Luberon market town, and just a short drive from the surrounding perched villages, this beautiful hotel and restaurant offers terrific potential with a wide variety of options to explore.The hotel guest accommodation comprises 20 air-conditioned bedrooms, that have been renovated and soundproofed, with four different levels of comfort.The first floor comprises a spacious reception room that leads through to the restaurant dining room (offering a capacity of 50 seats). A recently installed breakfast buffet area completes this dining space.The large and impressively equipped professional kitchens would allow for the capacity of the restaurant to be increased should the new owners desire to do so.An air-conditioned bar-lounge as well as five bedroom suites, are also located on the first floor.The second floor accommodates fifteen further bedroom suites, some of which benefit from a private roof terrace overlooking the swimming pool and the surrounding countryside.The lower floor (approximately 500 m2) would be ideally suited for conversion into a wellness centre, fitness room or a reception room for corporate events or weddings.The property sits on 2.5 acres of grounds, offering a variety of outdoor spaces; several paved terraces, two swimming pools, and a 'pétanque court'. A parking area is located to the front of the property.An adjoining stone 'mas' of 600 sqm currently offers independent living and could provide a further 15 bedrooms or be used for staff accommodation. This 'mas' is composed of three floors and benefits from its own private swimming pool and a separate gated entrance and parking area.This well-maintained establishment offers great scalability, with the possibility to expand the Hotel's current capacity, convert the property into a bed and breakfast, or create a reception hall for social or business events."!#""!#""!#""!#""!#""!#""!#""!#""!#""!#""!#""!#""!#""!#""!#""!#""!#""!#""!#""!#""!#""!#""!#""!#""!#""!#""!#""!#""!#""!#""!#""!#""!#""!#""!#""!#""!#""!#""!#""!#""!#""!#""!#""!#""!#""!#""!#""!#"V02635.01259L"!#"272"!#""!#""!#""!#""!#""!#""!#""!#""!#""!#""!#""!#""!#""!#""!#""!#""!#""!#""!#""!#""!#""!#""!#""!#""!#""!#""!#""!#""!#""!#""!#""!#""!#""!#""!#""!#""!#""!#""!#""!#""!#""!#""!#""!#""!#""!#""!#""!#""!#""!#""!#""!#""!#""!#""!#""!#""!#""!#""!#""!#""!#""!#""!#""!#""!#""!#""!#""!#""!#""!#""!#""!#""!#""!#""!#""!#""!#""!#""!#""!#""!#""!#""!#""!#""!#""!#""!#""!#""!#""!#""!#""!#""!#""!#""!#""!#""!#""!#""!#""!#""!#""!#""!#""!#""!#""!#""!#""!#""!#""!#""!#""!#""!#""!#""!#""!#""!#""!#""!#""!#""!#""!#""!#""!#""!#"4.12"!#"1"!#""!#""!#""!#""!#""!#""!#""!#""!#""!#""!#""!#""!#""!#""!#""!#""!#""!#""!#""!#""!#""!#""!#""!#""!#""!#""!#""!#""!#""!#""!#""!#""
""!#"V03041.01474L"!#"vente"!#"maison/villa"!#"84580"!#"OPPEDE"!#"France"!#""!#""!#""!#"3650000.00"!#""!#""!#""!#"0.0"!#"410.00"!#"2.50"!#"10"!#"8"!#"Fastueux mas entièrement rénové selon les standards les plus exigeants, à Oppède."!#"Situé au c?ur des paysages sereins d'Oppède, cet exceptionnel mas provençal allie charme intemporel et raffinement moderne. Derrière sa remarquable façade en pierre se dévoile une demeure méticuleusement rénovée selon les plus hauts standards, avec des matériaux haut de gamme et une harmonie parfaite entre architecture traditionnelle et élégance contemporaine.Une majestueuse allée bordée de cyprès, encadrée d?oliveraies et de vignobles, crée une arrivée inoubliable. En passant sous une impressionnante arche en pierre et un portail en bois, on découvre une superbe cour centrée autour d?une fontaine gracieuse, ombragée par des arbres matures ? une atmosphère empreinte de senteurs méditerranéennes et de sérénité.À l'intérieur, les volumes généreux et la lumière naturelle définissent les espaces de vie. Les éléments traditionnels ? poutres apparentes, plafonds provençaux et arches en pierre naturelle ? se marient harmonieusement avec des choix de design modernes et des matériaux contemporains. Le rez-de-chaussée comprend un vaste salon ouvrant sur la cour et la terrasse de la piscine grâce à de grandes baies vitrées, une cuisine moderne et élégante avec îlot central attenante à la salle à manger, deux chambres en suite, un salon plus intime avec cheminée, des toilettes invités et une buanderie.Un grand escalier situé dans l?entrée principale mène au premier étage, où se trouvent deux élégantes chambres en suite ainsi qu?une suite parentale avec salle de bain, dressing et charmant balcon Juliette. Un second escalier, partant de la salle à manger, mène à une suite impressionnante avec mezzanine, salle de bain luxueuse, terrasse privée avec accès indépendant à la cour, ainsi qu'une autre chambre en suite et un salon ? idéal pour accueillir famille ou invités.La propriété comprend également une charmante maison d'amis indépendante avec espace de vie et cuisine ouverts, chambre en mezzanine et salle d'eau.À l'extérieur, l'art de vivre provençal s?exprime dans toute sa splendeur : une terrasse ombragée avec cuisine d?été surplombe la cour, parfaite pour les repas et réceptions en plein air. À l'ouest, une piscine chauffée de 12 m x 5 m s?intègre harmonieusement à la terrasse en pierre, offrant une vue dégagée sur la campagne environnante.La rénovation a été réalisée selon les plus hauts standards, incluant chauffage et rafraîchissement par le sol au rez-de-chaussée, double isolation, menuiseries en aluminium, sept chauffe-eaux, et climatisation réversible à l?étage pour un confort optimal. Les prestations supplémentaires comprennent : cave à vin, raccordement à l?eau de ville et à un puits, arrosage automatique, portails électriques, vaste parking avec abri voiture, et fosse septique conforme à la réglementation.Chaque détail de cette demeure a été soigneusement pensé pour allier authenticité, élégance et confort moderne, offrant un cadre de vie d?une sérénité et d'un luxe incomparables au c?ur de la Provence.Les informations sur les risques auxquels ce bien est exposé sont disponibles sur le site Géorisques : http://www.georisques.gouv.fr"!#""!#""!#""!#"1"!#""!#""!#""!#"8"!#""!#"7"!#""!#""!#"1"!#""!#""!#""!#""!#""!#""!#""!#""!#"5"!#""!#""!#""!#""!#""!#""!#""!#""!#""!#""!#""!#""!#""!#""!#""!#""!#""!#""!#""!#""!#""!#""!#""!#""!#""!#""!#""!#""!#""!#""!#""!#""!#""!#""!#""!#""!#""!#""!#""!#""!#""!#""!#""!#""!#""!#""!#""!#""!#""!#""!#""!#""!#""!#""!#""!#""!#""!#""!#""!#""!#""!#""!#""!#""!#""!#""!#""!#""!#""!#""!#""!#""!#""!#""!#""!#""!#""!#""!#""!#""!#"EN"!#""!#"Magnificent farmhouse, fully renovated to the highest standards, in Oppède."!#"Set amid the serene landscapes of Oppède, this exceptional Provençal mas combines timeless charm with modern refinement. Behind its striking stone façade lies a home that has been meticulously renovated to the highest standards, using premium materials and showcasing an effortless blend of traditional architecture and contemporary elegance. A grand, cypress-lined driveway framed by olive groves and vineyards creates an unforgettable sense of arrival. Through an impressive stone arch and wooden gate, you enter a stunning courtyard centered around a graceful fountain shaded by mature trees - an atmosphere infused with Mediterranean scents and tranquility.Inside, generous volumes and natural light define the living spaces. Traditional elements ? exposed beams, Provencal ceilings, and natural stone archways ? blend seamlessly with modern design choices and contemporary materials. The ground floor offers a spacious living room that opens onto the courtyard and pool terrace through large sliding doors, a sleek modern kitchen with a central island flowing into the dining room, two en suite bedrooms, a cozy sitting room with fireplace, guest loo, and utility room.The grand staircase located in the main entrance leads to the first floor, which hosts two elegant en suite bedrooms and a principal suite with a bathroom, dressing room, and lovely Juliette balcony. A second staircase from the dining room leads to an impressive suite with lofted mezzanine, luxurious en suite bathroom, private terrace with independent courtyard access, and another en suite bedroom and sitting room - perfect for guests or family.The property also includes a charming independent guest house with open-plan living and kitchen area, mezzanine bedroom, and shower room.Outdoors, Provençal living is celebrated to perfection: a shaded terrace with summer kitchen overlooks the courtyard, ideal for outdoor dining and entertaining. To the west, a heated 12m x 5m pool blends seamlessly with the stone terrace, offering unobstructed views of the surrounding countryside.The renovation has been carried out to the highest standard, incorporating underfloor heating and cooling on the ground floor, double insulation, aluminium joinery, seven hot water heaters, and reversible air-conditioning on the first floor for additional comfort. Additional amenities include: wine cellar; mains and well water; automatic watering; electric gates; ample parking with carport; regulation-compliant septic tank.Every detail of this home has been thoughtfully crafted to combine authenticity, elegance, and modern comfort, offering a lifestyle of unmatched serenity and luxury in the heart of Provence."!#""!#""!#""!#""!#""!#""!#""!#""!#""!#""!#""!#""!#""!#""!#""!#""!#""!#""!#""!#""!#""!#""!#""!#""!#""!#""!#""!#""!#""!#""!#""!#""!#""!#""!#""!#""!#""!#""!#""!#""!#""!#""!#""!#""!#""!#""!#""!#"V03041.01474L"!#"106"!#""!#""!#""!#""!#""!#""!#""!#""!#""!#""!#""!#""!#""!#""!#""!#""!#""!#""!#""!#""!#""!#""!#""!#""!#""!#""!#""!#""!#""!#""!#""!#""!#""!#""!#""!#""!#""!#""!#""!#""!#""!#""!#""!#""!#""!#""!#""!#""!#""!#""!#""!#""!#""!#""!#""!#""!#""!#""!#""!#""!#""!#""!#""!#""!#""!#""!#""!#""!#""!#""!#""!#""!#""!#""!#""!#""!#""!#""!#""!#""!#""!#""!#""!#""!#""!#""!#""!#""!#""!#""!#""!#""!#""!#""!#""!#""!#""!#""!#""!#""!#""!#""!#""!#""!#""!#""!#""!#""!#""!#""!#""!#""!#""!#""!#""!#""!#""!#""!#""!#""!#""!#""!#""!#""!#"4.12"!#"1"!#""!#""!#""!#""!#""!#""!#""!#""!#""!#""!#""!#""!#""!#""!#""!#""!#""!#""!#""!#""!#""!#""!#""!#""!#""!#""!#""!#""!#""!#""!#""!#""
