""!#"V02674.01671L"!#"vente"!#"maison/villa"!#"84800"!#"L'ISLE-SUR-LA-SORGUE"!#"France"!#""!#""!#""!#"1450000.00"!#""!#""!#""!#"0.0"!#"328.00"!#"4280.00"!#"9"!#"5"!#"Bastide avec piscine chauffée près de l’Isle-sur-la-Sorgue"!#"Cette élégante bastide de style manoir bénéficie de magnifiques éléments d'origine, de volumes généreux et d'un jardin de 4000m2 offrant une parfaite intimité. D'importants travaux de rénovation ont été réalisés pour moderniser la propriété, avec un soin tout particulier apporté à la préservation du caractère authentique de cette bastide provençale traditionnelle.Le rez-de-chaussée comprend : hall d'entrée ; superbe cuisine dînatoire récemment installée avec plans de travail en marbre et poêle à bois ; salon avec cheminée en pierre de taille et plafonds traditionnels provençaux ; charmante bibliothèque/salle de musique ; salle à manger formelle ; buanderie ; impressionnante orangerie (72m² et 35m²) avec carrelage en tommettes et grandes portes-fenêtres en fer forgé s'ouvrant sur le jardin – récemment redécorés et rafraîchis, ces volumes exceptionnels offrent une belle polyvalence, que ce soit en tant que pièces de vie supplémentaires, ateliers créatifs, ou à des fins professionnelles (cours de yoga, séminaires, salles de réception, etc.).Le premier étage est composé de : vaste suite parentale avec salle de bains et dressing (un balconnet surplombe le jardin et baigne la pièce de lumière naturelle) ; chambre double avec salle de bains privative ; trois autres chambres ; deux salles de bains supplémentaires. De superbes carreaux décoratifs en ciment habillent l'ensemble de l'étage.Le jardin est entièrement clos et bordé de haies, garantissant une intimité totale. Une grande terrasse longe la façade de la maison, ombragée par deux platanes centenaires. L'élégante piscine chauffée (11m x 5m), est entourée d'une vaste terrasse et d'une pelouse généreuse – un cadre idyllique.Un abri voiture pour deux véhicules se trouve à l'arrière de la propriété, ainsi qu'un accès au vaste garage de 173m².La propriété a été rénovée et réaménagée avec des matériaux de qualité. Les travaux comprennent : toiture neuve ; cuisine neuve ; piscine chauffée et terrasse environnante ; installation de fenêtres et portes françaises sur mesure, à double vitrage et encadrements en bois ; nouvelle fosse septique ; système d'arrosage automatique ; et climatisation réversible installée dans l'ensemble de la maison, pour un confort optimal toute l'année.La propriété bénéficie d'un emplacement privilégié, à proximité immédiate de la très prisée ville de l'Isle-sur-la-Sorgue, renommée pour ses antiquaires, ses restaurants, sa vie culturelle, et à moins de 30 minutes de la gare TGV d'Avignon.Les informations sur les risques auxquels ce bien est exposé sont disponibles sur le site Géorisques : http://www.georisques.gouv.fr"!#""!#""!#""!#"2"!#""!#"1840"!#""!#"4"!#""!#""!#""!#""!#"3"!#""!#""!#""!#""!#""!#""!#""!#""!#""!#""!#""!#""!#""!#""!#""!#""!#""!#""!#""!#""!#""!#""!#""!#""!#""!#""!#""!#""!#""!#"OUI"!#"OUI"!#""!#""!#""!#""!#""!#""!#""!#""!#""!#""!#""!#""!#""!#""!#""!#""!#""!#""!#""!#""!#""!#""!#""!#""!#""!#""!#""!#""!#""!#""!#""!#""!#""!#""!#""!#""!#""!#""!#"https://my.matterport.com/show/?m=S6oiHMeK8ku"!#""!#""!#""!#""!#""!#""!#""!#""!#""!#""!#""!#""!#""!#""!#""!#""!#""!#""!#""!#"EN"!#""!#"Renovated bastide with heated pool near L'Isle-sur-la-Sorgue"!#"This elegant manor-style property benefits from gorgeous original features, excellent volumes and a wonderfully private one-acre garden. Extensive renovation works have been carried out to modernise it, with great care taken to maintain and preserve the innate grandeur of this traditional Provençal Bastide.The accommodation comprises, on the ground floor: entrance hall; newly installed dining kitchen with marble worktops and a wood-burning stove; sitting room with ornate stone fireplace and traditional Provençal ceilings; lovely library/music room; formal dining room; utility room; impressive 'orangerie' spaces (72 sq.m and 35 sq.m) with authentic terracotta tiling and oversized wrought-iron French doors opening onto the garden - recently redecorated and refreshed, these offer fantastic versatility, whether as additional living rooms, creative studios, or for potential professional use (yoga classes, seminars, reception rooms, etc.).The first floor comprises: spacious master suite complete with bathroom and dressing area (and a Juliette-style balcony overlooking the garden, flooding the room with natural light); double bedroom with ensuite bathroom; three further double bedrooms; two guest bathrooms. Beautiful decorative cement tiles flow throughout the first floor.The garden is entirely hedged and fenced for privacy. A large terrace runs along the front of the house, shaded by two centenary traditional plane trees. The large 11m x 5m elegant swimming-pool is heated (by a newly installed heat pump) and surrounded by a wide terrace and a large lawned area. A carport for two vehicles is located to the rear of the property, along with access to the vast (173 sq.m) garage.The property has been renovated and refurbished with high quality materials. The renovation includes: roof entirely replaced and insulated; newly fitted kitchen; heated swimming-pool and surrounding terrace; installation of bespoke, wood-framed and double-glazed, French windows and doors throughout; newly installed septic tank; automatic watering system; and the installation of reversible air conditioning throughout the house, ensuring year-round comfort.The property is very well-located close to the desirable market town of l’Isle-sur-la-Sorgue, famous for its antiques and restaurants, cultural life and less than 30 minutes from the Avignon TGV station.The information about the risks to which this property is exposed is available on the Géorisques website: http://www.georisques.gouv.fr"!#""!#""!#""!#""!#""!#""!#""!#""!#""!#""!#""!#""!#""!#""!#""!#""!#""!#""!#""!#""!#""!#""!#""!#""!#""!#""!#""!#""!#""!#""!#""!#""!#""!#""!#""!#""!#""!#""!#""!#""!#""!#""!#""!#""!#""!#""!#""!#"V02674.01671L"!#"99"!#""!#""!#""!#""!#""!#""!#""!#""!#""!#""!#""!#""!#""!#""!#""!#""!#""!#""!#""!#""!#""!#""!#""!#""!#""!#""!#""!#""!#""!#""!#""!#""!#""!#""!#""!#""!#""!#""!#""!#""!#""!#""!#""!#""!#""!#""!#""!#""!#""!#""!#""!#""!#""!#""!#""!#""!#""!#""!#""!#""!#""!#""!#""!#""!#""!#""!#""!#""!#""!#""!#""!#""!#""!#""!#""!#""!#""!#""!#""!#""!#""!#""!#""!#""!#""!#""!#""!#""!#""!#""!#""!#""!#""!#""!#""!#""!#""!#""!#""!#""!#""!#""!#""!#""!#""!#""!#""!#""!#""!#""!#""!#""!#""!#""!#""!#""!#""!#""!#""!#""!#""!#""!#""!#""!#"4.12"!#"1"!#""!#""!#""!#""!#""!#""!#""!#""!#""!#""!#""!#""!#""!#""!#""!#""!#""!#""!#""!#""!#""!#""!#""!#""!#""!#""!#""!#""!#""!#""!#""!#""
""!#"V02738.01227L"!#"vente"!#"maison/villa"!#"84400"!#"RUSTREL"!#"France"!#""!#""!#""!#"2295000.00"!#""!#""!#""!#"0.0"!#"406.00"!#"7871.00"!#"11"!#"5"!#"Magnifique bastide du 18e siècle avec piscine et superbe jardin."!#"Magnifique Bastide du 18ème siècle disposant d'un espace habitable généreux et spacieux d'environ 412 m2, offrant des vues superbes sur le paysage du Luberon. Sublimé par un enorme espace de réception baignée de lumière, la propriété comprend une orangerie extraordinaire avec son élégante cheminée, un lustre opulent fabriqué sur mesure et le tout dans un équilibre harmonieux parfait. Cette piece superbe est équipée de sa propre cuisine et WC. La Bastide, offrant des vues superbes soit sur le massif des ocres du Colorado Provençal, soit sur les monts du Vaucluse comprend au rez-de-chaussée : une très grande orangerie avec cuisine et WC ; un hall attenant qui communique avec la maison principale ; un hall d'entrée ; un grand salon avec cheminée ; un bureau ; une salle de lecture / bibliothèque ; une cuisine équipée et salle à manger ouverte avec cheminée ; une buanderie."!#""!#""!#""!#"3"!#""!#"1780"!#""!#"5"!#""!#"3"!#""!#""!#"6"!#""!#""!#""!#""!#""!#""!#""!#""!#"2"!#""!#""!#""!#""!#""!#""!#""!#""!#""!#""!#""!#""!#""!#""!#""!#""!#""!#""!#""!#""!#""!#"OUI"!#""!#""!#""!#""!#""!#""!#""!#""!#""!#""!#""!#""!#""!#""!#""!#""!#""!#""!#""!#""!#""!#""!#""!#""!#""!#""!#""!#""!#""!#""!#""!#""!#""!#""!#""!#""!#""!#""!#""!#""!#""!#""!#""!#""!#""!#""!#""!#""!#""!#""!#""!#""!#""!#""!#""!#""!#""!#""!#"EN"!#""!#"Beautiful 18th century bastide with pool and walled garden."!#"This magnificent 18th century Bastide offers plentiful living space includes five bedrooms and is set in a beautiful rural location with lovely views to the surrounding Luberon countryside. The property offers an unusual and stunning Orangery of about 79m2 which provides the house with an enviable light-filled entertaining room. The Orangery's nine arched double doors allow views to the garden and the room has been decorated with elegance and style to include a custom made chandelier and an impressive stone fireplace.Meticulously maintained, the large walled garden features an elegant lavender and cypress-lined driveway. Several courtyards wrap around the property, providing a choice of different areas for outside dining, relaxation or enjoyment of the Provençal sunshine. The heated 11m x 5m pool and summer kitchen are located at one end of the garden. The Bastide is set in a beautiful rural location, with views to the famous ochre hills of the Colorado."!#""!#""!#""!#""!#""!#""!#""!#""!#""!#""!#""!#""!#""!#""!#""!#""!#""!#""!#""!#""!#""!#""!#""!#""!#""!#""!#""!#""!#""!#""!#""!#""!#""!#""!#""!#""!#""!#""!#""!#""!#""!#""!#""!#""!#""!#""!#""!#"V02738.01227L"!#"314"!#""!#""!#""!#""!#""!#""!#""!#""!#""!#""!#""!#""!#""!#""!#""!#""!#""!#""!#""!#""!#""!#""!#""!#""!#"OUI"!#""!#""!#""!#""!#""!#""!#""!#""!#""!#""!#""!#""!#""!#""!#""!#""!#""!#""!#""!#""!#""!#""!#""!#""!#""!#""!#""!#""!#""!#""!#""!#""!#""!#""!#""!#""!#""!#""!#""!#""!#""!#""!#""!#""!#""!#""!#""!#""!#""!#""!#""!#""!#""!#""!#""!#""!#""!#""!#""!#""!#""!#""!#""!#""!#""!#""!#""!#""!#""!#""!#""!#""!#""!#""!#""!#""!#""!#""!#""!#""!#""!#""!#""!#""!#""!#""!#""!#""!#""!#""!#""!#""!#""!#""!#""!#""!#""!#""!#""!#"4.12"!#"1"!#""!#""!#""!#""!#""!#""!#""!#""!#""!#""!#""!#""!#""!#""!#""!#""!#""!#""!#""!#""!#""!#""!#""!#""!#""!#""!#""!#""!#""!#""!#""!#""
""!#"V02816.01188L"!#"vente"!#"maison/villa"!#"84210"!#"VENASQUE"!#"France"!#""!#""!#""!#"649000.00"!#""!#""!#""!#"0.0"!#"284.00"!#"537.00"!#"8"!#"4"!#"Authentique maison de village avec jardin clos et vues superbes"!#"Au cœur du village prisé de Venasque, classé parmi les plus beaux villages de France, cette charmante maison d'environ 284 m² bénéficie d'une vue absolument exceptionnelle sur la campagne environnante et le Mont Ventoux. La propriété dispose d'une cour, de plusieurs terrasses et d'un spacieux jardin offrant des vues complètement dégagées, permettant de profiter pleinement des espaces extérieurs en toute saison.Actuellement agencée en deux habitations indépendantes, la propriété offre une grande souplesse d'utilisation et pourrait facilement être réunie pour former une maison familiale unique, selon les besoins.La première habitation comprend : une entrée desservant un vaste espace de vie décloisonné, avec cuisine et salle à manger attenantes, le tout agrémenté d'une cheminée ; deux chambres spacieuses, chacune avec salle de bains privative et vues splendides sur le paysage environnant.La seconde habitation, située en rez-de-jardin, est accessible par la cour ou par un escalier extérieur. Elle comprend : un généreux salon creusé dans la roche ; une cuisine ouverte ; deux chambres ; une salle de bains commune ; une buanderie. Un atelier et une cave complètent l'ensemble.Cette propriété lumineuse et pleine de caractère présente de nombreux éléments d'origine et un charme indéniable. Avec quelques travaux de rafraîchissement, cette maison pourrait devenir à la fois un superbe pied-à-terre et un investissement sûr. Elle conviendrait parfaitement comme résidence principale, maison de vacances ou bien investissement locatif saisonnier. Les commerces et restaurants du centre du village sont accessibles à pied, et la gare TGV d'Avignon se trouve à seulement 40 minutes.Les informations sur les risques auxquels ce bien est exposé sont disponibles sur le site Géorisques : http://www.georisques.gouv.fr"!#""!#""!#""!#""!#""!#""!#""!#"3"!#""!#"4"!#""!#""!#"9"!#""!#""!#""!#""!#""!#""!#""!#""!#""!#""!#""!#""!#""!#""!#""!#""!#""!#""!#""!#""!#""!#""!#""!#""!#""!#""!#""!#""!#""!#""!#""!#""!#""!#""!#""!#""!#""!#""!#""!#""!#""!#""!#""!#""!#""!#""!#""!#""!#""!#""!#""!#""!#""!#""!#""!#""!#""!#""!#""!#""!#""!#""!#""!#""!#""!#""!#""!#""!#""!#"https://my.matterport.com/show/?m=ig1mwWxEgxk"!#""!#""!#""!#""!#""!#""!#""!#""!#""!#""!#""!#""!#""!#""!#""!#""!#""!#""!#""!#"EN"!#""!#"Authentic village house with walled garden and stunning views"!#"In the heart of the desirable village of Venasque - listed among the most beautiful villages in France - this charming 284 m² house offers utterly superb views of the surrounding countryside and Mont Ventoux. The property benefits from a courtyard, several terraces, and a lovely garden with far-reaching views, providing a variety of outdoor spaces to enjoy throughout the seasons.Currently arranged as two independent dwellings, the property offers flexibility of use and could easily be reconfigured as a single family house if desired.The first house comprises: entrance hall leading to a vast open-plan living space, with an adjoining kitchen and dining area, complete with a fireplace; two double bedrooms, each with an ensuite bathroom and incredible views of the surrounding landscape.The second house, located on the garden level, is accessed via the courtyard or by an external staircase. This portion of the property includes: generous sitting room carved into the rock; open-plan kitchen; two bedrooms; shared bathroom; laundry room. A workshop and a wine cellar complete the accommodation.This bright and characterful property offers many original features and a great deal of charm. With a few refreshing works, this house could become both a superb pied-à-terre and a sound investment. It would make a superb year-round residence, second home, or seasonal rental investment. The shops and restaurants of the village centre are within walking distance, and Avignon TGV station can be reached in just 40 minutes."!#""!#""!#""!#""!#""!#""!#""!#""!#""!#""!#""!#""!#""!#""!#""!#""!#""!#""!#""!#""!#""!#""!#""!#""!#""!#""!#""!#""!#""!#""!#""!#""!#""!#""!#""!#""!#""!#""!#""!#""!#""!#""!#""!#""!#""!#""!#""!#"V02816.01188L"!#"169"!#""!#""!#""!#""!#""!#""!#""!#""!#""!#""!#""!#""!#""!#""!#""!#""!#""!#""!#""!#""!#""!#""!#""!#""!#""!#""!#""!#""!#""!#""!#""!#""!#""!#""!#""!#""!#""!#""!#""!#""!#""!#""!#""!#""!#""!#""!#""!#""!#""!#""!#""!#""!#""!#""!#""!#""!#""!#""!#""!#""!#""!#""!#""!#""!#""!#""!#""!#""!#""!#""!#""!#""!#""!#""!#""!#""!#""!#""!#""!#""!#""!#""!#""!#""!#""!#""!#""!#""!#""!#""!#""!#""!#""!#""!#""!#""!#""!#""!#""!#""!#""!#""!#""!#""!#""!#""!#""!#""!#""!#""!#""!#""!#""!#""!#""!#""!#""!#""!#""!#""!#""!#""!#""!#""!#"4.12"!#"1"!#""!#""!#""!#""!#""!#""!#""!#""!#""!#""!#""!#""!#""!#""!#""!#""!#""!#""!#""!#""!#""!#""!#""!#""!#""!#""!#""!#""!#""!#""!#""!#""
""!#"V02782.01624L"!#"vente"!#"maison/villa"!#"13940"!#"MOLLEGES"!#"France"!#""!#""!#""!#"980000.00"!#""!#""!#""!#"0.0"!#"260.00"!#"331.00"!#"7"!#"5"!#"Somptueuse maison de village, entièrement rénovée, située dans les Alpilles."!#"Cette somptueuse propriété, située dans le village Mollégès, à récemment été entièrement rénovée, offrant un mélange harmonieux d'architecture provençale et de confort moderne. La propriété est ornée de magnifiques éléments authentiques et de matériaux nobles et naturels qui lui confèrent un caractère et un charme intemporel. La maison principale accueille, au rez-de-chaussée : cuisine ; arrière-cuisine ; salon, vaste et lumineux, avec une belle cheminée en pierre de taille, véritable témoin du 18e siècle, et un plafond provençal magnifiquement décoré de poutres apparentes ; WC.L'étage se compose de : trois chambres doubles, chacune avec une salle de bains, ornées de terre cuite vernissée, et WC attenants. La maison comprend également une annexe jouissante, au rez-de-chaussée, de : cuisine ouverte sur le séjour, proposant un espace indépendant et confortable pour les invités. Un élégant escalier Napoléon III mène à l'étage, où se trouvent : deux chambres doubles partageant une salle de bain et un WC. De ces chambres, la vue sur le clocher ajoute une dimension pittoresque et apaisante.À l'extérieur, la propriété s'embellit d'une cuisine d'été et d'une cour intérieure avec terrasse, idéale pour les soirées estivales. Un bassin en pierre, 3m x 2m, et une douche extérieure complètent ce cadre bucolique. Les équipements comprennent : chauffage et refroidissement par le sol (pompe à chaleur) ; climatisation gainable dans les chambres ; tout à l'égout ; double vitrage ; eau de ville ; portail électrique ; vidéophone ; éclairage jardin ; internet par fibre optique.Grâce à l'alliance du charme d'antan et le confort moderne, cette demeure, parfaitement située, offre une qualité de vie exceptionnelle. Les commerces et restaurants du village se trouvent à quelques pas."!#""!#""!#""!#"1"!#""!#"1850"!#""!#"4"!#""!#"5"!#""!#""!#"3"!#""!#""!#""!#""!#""!#""!#""!#""!#""!#""!#""!#""!#""!#""!#""!#""!#""!#""!#""!#""!#""!#""!#""!#""!#""!#""!#""!#""!#""!#"OUI"!#"OUI"!#""!#""!#""!#""!#""!#""!#""!#""!#""!#""!#""!#""!#""!#""!#""!#""!#""!#""!#""!#""!#""!#""!#""!#""!#""!#""!#""!#""!#""!#""!#""!#""!#""!#""!#""!#""!#""!#""!#""!#""!#""!#""!#""!#""!#""!#""!#""!#""!#""!#""!#""!#""!#""!#""!#""!#""!#""!#""!#"EN"!#""!#"Beautifully renovated village property in the heart of the Alpilles."!#"This lovely property, located in the village of Mollégès, has been thoroughly and thoughtfully renovated, seamlessly integrating traditional Provençal architectural features and a wide range of modern comforts. The property is adorned with gorgeous natural materials and timelessly elegant décor.The accommodation on the ground floor comprises: kitchen; utility room; bright and spacious sitting room with a beautiful 18th-century stone fireplace and exposed wooden beams; guest loo.The first floor is composed of: three lovely double bedrooms, each with a bathroom en suite, adorned with decorative glazed terracotta tiling and ornate fittings.The property also features an independent guest house. The ground floor accommodates an open-plan kitchen flowing through to the sitting room. A handsome Napoléon III staircase leads to the first floor, composed of two double bedrooms sharing a bathroom and a loo. A large arched window in the bedroom grants a view on to the local bell tower.The large walled garden is complemented by a summer kitchen and a terrace shaded by a Pergola, providing the perfect spot for outdoor dining and entertaining. A stone-clad plunge pool, 3m x 2m, and an outdoor shower complete this picturesque setting.Amenities include: underfloor heating and cooling throughout the ground floor; reversible air conditioning in the bedrooms; mains drainage; double glazing; mains water; electric gates; videophone; garden lighting; fibre optic internet.Thanks to the well-conceived layout, lofty volumes, exquisite décor and host of modern amenities, this property ensures an exceptional standard of living - in the heart of the Alpilles. The village's shops and restaurants are just a few steps away."!#""!#""!#""!#""!#""!#""!#""!#""!#""!#""!#""!#""!#""!#""!#""!#""!#""!#""!#""!#""!#""!#""!#""!#""!#""!#""!#""!#""!#""!#""!#""!#""!#""!#""!#""!#""!#""!#""!#""!#""!#""!#""!#""!#""!#""!#""!#""!#"V02782.01624L"!#"97"!#""!#""!#""!#""!#""!#""!#""!#""!#""!#""!#""!#""!#""!#""!#""!#""!#""!#""!#""!#""!#""!#""!#""!#""!#""!#""!#""!#""!#""!#""!#""!#""!#""!#""!#""!#""!#""!#""!#""!#""!#""!#""!#""!#""!#""!#""!#""!#""!#""!#""!#""!#""!#""!#""!#""!#""!#""!#""!#""!#""!#""!#""!#""!#""!#""!#""!#""!#""!#""!#""!#""!#""!#""!#""!#""!#""!#""!#""!#""!#""!#""!#""!#""!#""!#""!#""!#""!#""!#""!#""!#""!#""!#""!#""!#""!#""!#""!#""!#""!#""!#""!#""!#""!#""!#""!#""!#""!#""!#""!#""!#""!#""!#""!#""!#""!#""!#""!#""!#""!#""!#""!#""!#""!#""!#"4.12"!#"1"!#""!#""!#""!#""!#""!#""!#""!#""!#""!#""!#""!#""!#""!#""!#""!#""!#""!#""!#""!#""!#""!#""!#""!#""!#""!#""!#""!#""!#""!#""!#""!#""
""!#"V02991.01316L"!#"vente"!#"maison/villa"!#"84220"!#"CABRIERES-D'AVIGNON"!#"France"!#""!#""!#""!#"1190000.00"!#""!#""!#""!#"0.0"!#"157.00"!#"1600.00"!#"5"!#"4"!#"Ravissante propriété avec vues et terrain constructible."!#"Située dans un environnement paisible, et à seulement cinq minutes à pied d'un charmant village provençal, cette propriété offre des superbes vues sur le massif du Luberon et les étendues dorées de vignes. Le rez-de-chaussée se compose de : vaste pièce ouverte comprenant belle cuisine Fabre, salle à manger et salon - toutes les pièces s'ouvrent sur les terrasses extérieures ; buanderie ; WC invités. Au premier étage se trouve : suite parentale avec salle de bains attenante ; trois chambres, chacune dotée d'une salle d'eau attenante ; WC. À l'écart de la maison principale, une jolie dépendance accueille un spacieux bureau avec mezzanine, offrant ainsi de multiples possibilités d'aménagement. Les jardins s'articulent autour d'une somptueuse terrasse partiellement couverte, offrant un cadre privilégié pour des moments de convivialité, en toute saison, ainsi qu'une piscine de 12m x 4m, dotée du système de nettoyage Diffaclean de Diffazur. À l'arrière de la maison, le jardin s'ouvre sur un terrain constructible, invitant à imaginer de nouveaux projets d'agrandissement afin de créer davantage d'espace et de charme, ou même un garage.Les équipements comprennent : chauffage et refroidissement au sol par système de pompe à chaleur ; climatisation à l'étage ainsi que dans la dépendance ; double vitrage ; internet par fibre optique ; portail électrique ; arrosage automatique, goutte à goutte ; eau de ville ; tout-à-l'égout ; local piscine ; machinerie ; auvent. Grâce à ses magnifiques jardins, son terrain constructible et ses généreux volumes, cette propriété offre un équilibre subtil entre modernité et tradition, où intérieur et extérieur se mêlent harmonieusement.Les informations sur les risques auxquels ce bien est exposé sont disponibles sur le site Géorisques : http://www.georisques.gouv.fr"!#""!#""!#""!#"1"!#""!#"2007"!#""!#"4"!#""!#"2"!#""!#""!#"1"!#""!#""!#""!#""!#""!#""!#""!#""!#"4"!#""!#""!#""!#""!#""!#""!#""!#""!#""!#""!#""!#""!#""!#""!#""!#""!#""!#""!#""!#""!#"OUI"!#""!#""!#""!#""!#""!#""!#""!#""!#""!#""!#""!#""!#""!#""!#""!#""!#""!#""!#""!#""!#""!#""!#""!#""!#""!#""!#""!#""!#""!#""!#""!#""!#""!#""!#""!#""!#""!#""!#""!#"https://my.matterport.com/show/?m=T3Ukyg9fjy7"!#""!#""!#""!#""!#""!#""!#""!#""!#""!#""!#""!#""!#""!#""!#""!#""!#""!#""!#""!#"EN"!#""!#"Lovely property with views and a constructible plot of land."!#"Located in a peaceful setting and just a five-minute walk from a charming Provençal village, this property enjoys stunning views of the Luberon and vineyards bathed in golden hues.The ground floor is composed of: spacious living area with a beautiful Fabre kitchen, dining room, and sitting room, all of which open onto the outdoor terraces; laundry room; guest loo.The first floor comprises: master suite with bathroom en suite; three additional bedrooms, each with en suite shower rooms; loo.Steps away from the main house, a delightful annexe accommodates a large office with a mezzanine, offering a flexible working space or an artists atelier. The gardens enjoy a magnificent, partially covered terrace, ideal for year-round outdoor gatherings, as well as a 12m x 4m swimming pool equipped with a Diffazur self-cleaning Diffaclean system. At the rear of the house, the garden opens onto a constructible plot of land - providing the potential to create additional space, expand the property or add a garage.Amenities include: underfloor heating and cooling via a heat pump system; air conditioning; double glazing; fibre optic internet; electric gates; automatic watering system; mains water ; mains drainage; pool house; large storage space; carport.With its beautiful gardens, constructible land, and generous living spaces, this property strikes a perfect balance between modern comforts and authenticity, seamlessly blending indoor and outdoor living."!#""!#""!#""!#""!#""!#""!#""!#""!#""!#""!#""!#""!#""!#""!#""!#""!#""!#""!#""!#""!#""!#""!#""!#""!#""!#""!#""!#""!#""!#""!#""!#""!#""!#""!#""!#""!#""!#""!#""!#""!#""!#""!#""!#""!#""!#""!#""!#"V02991.01316L"!#"137"!#""!#""!#""!#""!#""!#""!#""!#""!#""!#""!#""!#""!#""!#""!#""!#""!#""!#""!#""!#""!#""!#""!#""!#""!#""!#""!#""!#""!#""!#""!#""!#""!#""!#""!#""!#""!#""!#""!#""!#""!#""!#""!#""!#""!#""!#""!#""!#""!#""!#""!#""!#""!#""!#""!#""!#""!#""!#""!#""!#""!#""!#""!#""!#""!#""!#""!#""!#""!#""!#""!#""!#""!#""!#""!#""!#""!#""!#""!#""!#""!#""!#""!#""!#""!#""!#""!#""!#""!#""!#""!#""!#""!#""!#""!#""!#""!#""!#""!#""!#""!#""!#""!#""!#""!#""!#""!#""!#""!#""!#""!#""!#""!#""!#""!#""!#""!#""!#""!#""!#""!#""!#""!#""!#""!#"4.12"!#"1"!#""!#""!#""!#""!#""!#""!#""!#""!#""!#""!#""!#""!#""!#""!#""!#""!#""!#""!#""!#""!#""!#""!#""!#""!#""!#""!#""!#""!#""!#""!#""!#""
